<?xml version='1.0' encoding='utf-8'?>

<!ELEMENT service (description?, service-class, parameter*)>
<!ATTLIST service enabled CDATA #IMPLIED>

<!ELEMENT service-class (#PCDATA)>

<!ELEMENT description (#PCDATA)>

<!ELEMENT parameter (param-name, param-value)>
<!ELEMENT param-name (#PCDATA)>
<!ELEMENT param-value (#PCDATA)>
