<?xml version="1.0" encoding="UTF-8"?>
<!DOCTYPE service PUBLIC
  "-//Penrose/DTD Service ${product.specification}//EN"
  "http://penrose.safehaus.org/dtd/service.dtd">

<service enabled="true">

  <service-class>org.safehaus.penrose.management.PenroseJMXService</service-class>

  <parameter>
    <param-name>rmiPort</param-name>
    <param-value>1099</param-value>
  </parameter>

  <parameter>
    <param-name>rmiTransportPort</param-name>
    <param-value>40888</param-value>
  </parameter>

</service>
