<?xml version="1.0" encoding="UTF-8"?>
<!DOCTYPE service PUBLIC
  "-//Penrose/DTD Service ${product.specification}//EN"
  "http://penrose.safehaus.org/dtd/service.dtd">

<service enabled="false">
    
  <service-class>org.safehaus.penrose.apacheds.ApacheDSService</service-class>
  
  <parameter>
    <param-name>ldapPort</param-name>
    <param-value>10389</param-value>
  </parameter>
    
  <parameter>
    <param-name>enableLdaps</param-name>
    <param-value>false</param-value>
  </parameter>
    
  <parameter>
    <param-name>ldapsPort</param-name>
    <param-value>10636</param-value>
  </parameter>
    
  <parameter>
    <param-name>ldapsCertificateFile</param-name>
    <param-value>conf/penrose.keystore</param-value>
  </parameter>
    
  <parameter>
    <param-name>ldapsCertificatePassword</param-name>
    <param-value>changeit</param-value>
  </parameter>
    
  <parameter>
    <param-name>allowAnonymousAccess</param-name>
    <param-value>true</param-value>
  </parameter>
    
</service>
